{
  "contract": "knowitall.code-context/v1", "request_id": "req-42", "project_id": "project-synthetic", "repository_id": "repo-python-service",
  "resolved": {"snapshot_id": "snap-python-0001", "commit": "sha1:1111111111111111111111111111111111111111", "content_manifest_digest": "sha256:aaaaaaaaaaaaaaaaaaaaaaaaaaaaaaaaaaaaaaaaaaaaaaaaaaaaaaaaaaaaaaaa", "generation_id": "gen-python-0001", "artifact_digest": "sha256:dddddddddddddddddddddddddddddddddddddddddddddddddddddddddddddddd"},
  "status": "ok", "coverage": {"inventory": "complete", "extraction": "complete", "relevant_scope": "complete", "limitations": []},
  "evidence": [{"evidence_id": "edge-submit-to-save", "grade": "deterministic_extraction", "kind": "calls", "subject": {"symbol_id": "python:src/orders.py:submit_order", "name": "submit_order"}, "object": {"symbol_id": "python:src/store.py:save_order", "name": "save_order"}, "locator": {"path": "src/orders.py", "start": {"line": 8, "column": 5}, "end": {"line": 8, "column": 24}, "content_digest": "sha256:bbbbbbbbbbbbbbbbbbbbbbbbbbbbbbbbbbbbbbbbbbbbbbbbbbbbbbbbbbbbbbbb"}}],
  "ambiguities": [], "missing_evidence": [], "truncated": false, "continuation": null
}
